<schema xmlns="http://www.w3.org/2001/XMLSchema" targetNamespace="stendhal"
	xmlns:tns="http://www.example.org/zones" elementFormDefault="qualified"
	xmlns:Q1="stendhal">

	<element name="items" type="Q1:itemGroup"></element>

	<complexType name="itemGroup">
		<sequence>
			<element name="item" type="Q1:itemType" minOccurs="0"
				maxOccurs="unbounded"></element>
		</sequence>
	</complexType>

	<simpleType name="tooltipCategory">
		<restriction base="string">
			<enumeration value="weapon"/>
			<enumeration value="armour"/>
			<enumeration value="accessory"/>
			<enumeration value="other"/>
		</restriction>
	</simpleType>

	<complexType name="itemType">
		<sequence>
			<element name="type" type="Q1:typeType" />
			<element name="description" type="string"></element>
			<element name="implementation" type="Q1:implementation"></element>
			<element name="unattainable" type="anyType" minOccurs="0" maxOccurs="1"></element>
			<element name="behavior" type="Q1:behavior" minOccurs="0" maxOccurs="1"></element>
			<element name="attributes" type="Q1:attributes"></element>
			<element name="weight" type="Q1:attribute" minOccurs="0" maxOccurs="1" />
			<element name="value" type="Q1:attribute" minOccurs="0" maxOccurs="1" />
			<element name="preview" type="string" minOccurs="0" maxOccurs="1" />
			<element name="susceptibility" type="Q1:susceptibility" minOccurs="0" maxOccurs="unbounded"></element>
			<element name="equipable" type="Q1:equipable"></element>
		</sequence>
		<attribute name="name" type="string" use="required"></attribute>
		<attribute name="condition" type="string"></attribute>
		<attribute name="rarity-enabled" type="boolean"></attribute>
		<attribute name="rarity-profile" type="string"></attribute>
		<attribute name="tooltip-category" type="Q1:tooltipCategory"></attribute>
	</complexType>

	<complexType name="typeType">
		<attribute name="class" type="string"></attribute>
		<attribute name="subclass" type="string"></attribute>
		<attribute name="tileid" type="int"></attribute>
	</complexType>

	<complexType name="implementation">
		<attribute name="class-name" type="string"></attribute>
	</complexType>
	
	<complexType name="behavior">
		<sequence>
			<element name="parameter" type="Q1:pair" minOccurs="0" maxOccurs="unbounded"/>
		</sequence>
		<attribute name="class-name" type="string"/>
	</complexType>
	
	<complexType name="pair">
		<attribute name="name" type="string"/>
		<attribute name="value" type="string"/>
	</complexType>

	<complexType name="attributes">
		<sequence>
			<element name="itemdata" type="Q1:attribute" minOccurs="0"/>
			<element name="atk" type="Q1:attribute" minOccurs="0"/>
			<element name="ratk" type="Q1:attribute" minOccurs="0"/>
			<element name="damage_min" type="Q1:attribute" minOccurs="0"/>
			<element name="damage_max" type="Q1:attribute" minOccurs="0"/>
			<element name="def" type="Q1:attribute" minOccurs="0"/>
			<element name="immunization" type="Q1:attribute" minOccurs="0"/>
			<element name="amount" type="Q1:attribute" minOccurs="0" maxOccurs="unbounded"/>
			<element name="frequency" type="Q1:attribute" minOccurs="0" maxOccurs="unbounded"/>
			<element name="range" type="Q1:attribute" minOccurs="0"/>
			<element name="quantity" type="Q1:attribute" minOccurs="0"/>
			<element name="max_quantity" type="Q1:attribute" minOccurs="0"/>
			<element name="regen" type="Q1:attribute" minOccurs="0" maxOccurs="unbounded"/>
			<element name="lifesteal" type="Q1:attribute" minOccurs="0"/>
			<element name="parry_chance" type="Q1:attribute" minOccurs="0"/>
			<element name="armor_penetration" type="Q1:attribute" minOccurs="0"/>
			<element name="critical_damage_bonus" type="Q1:attribute" minOccurs="0"/>
			<element name="bleed_on_hit" type="Q1:attribute" minOccurs="0"/>
			<element name="execute_damage" type="Q1:attribute" minOccurs="0"/>
			<element name="poison_on_hit" type="Q1:attribute" minOccurs="0"/>
			<element name="distance_damage" type="Q1:attribute" minOccurs="0"/>
			<element name="flat_attack_bonus" type="Q1:attribute" minOccurs="0"/>
			<element name="flat_defense_bonus" type="Q1:attribute" minOccurs="0"/>
			<element name="resist_poisoned" type="Q1:attribute" minOccurs="0"/>
			<element name="resist_bleeding" type="Q1:attribute" minOccurs="0"/>
			<element name="resist_shocked" type="Q1:attribute" minOccurs="0"/>
			<element name="resist_confused" type="Q1:attribute" minOccurs="0"/>
			<element name="resist_heavy" type="Q1:attribute" minOccurs="0"/>
			<element name="resist_stunned" type="Q1:attribute" minOccurs="0"/>
			<element name="skill_atk" type="Q1:attribute" minOccurs="0"/>
			<element name="atk_additional_bonus" type="Q1:attribute" minOccurs="0"/>
			<element name="critical_additional_bonus" type="Q1:attribute" minOccurs="0"/>
			<element name="def_additional_bonus" type="Q1:attribute" minOccurs="0"/>
			<element name="rate_increase" type="Q1:attribute" minOccurs="0"/>
			<element name="critical_chance" type="Q1:attribute" minOccurs="0"/>
			<element name="critical_bonus_reduction" type="Q1:attribute" minOccurs="0"/>
			<element name="out_of_combat_regen" type="Q1:attribute" minOccurs="0"/>
			<element name="consumable_healing_bonus" type="Q1:attribute" minOccurs="0"/>
			<element name="physical_dodge_chance" type="Q1:attribute" minOccurs="0"/>
			<element name="low_health_damage_reduction" type="Q1:attribute" minOccurs="0"/>
			<element name="nightmare_chance" type="Q1:attribute" minOccurs="0"/>
			<element name="lifesteal_increase" type="Q1:attribute" minOccurs="0"/>
			<element name="health" type="Q1:attribute" minOccurs="0"/>
			<element name="persistent" type="Q1:attribute" minOccurs="0"/>
			<element name="life_support" type="Q1:attribute" minOccurs="0"/>
			<element name="slot_name" type="Q1:attribute" minOccurs="0"/>
			<element name="undroppableondeath" type="Q1:attribute" minOccurs="0"/>
			<element name="autobind" type="Q1:attribute" minOccurs="0"/>
			<element name="slot_size" type="Q1:attribute" minOccurs="0"/>
			<element name="menu" type="Q1:attribute" minOccurs="0"/>
			<element name="durability" type="Q1:attribute" minOccurs="0" maxOccurs="1"/>
			<element name="itemset" type="Q1:attribute" minOccurs="0"/>
			<element name="use_sound" type="Q1:attribute" minOccurs="0" maxOccurs="1"/>
		</sequence>
	</complexType>

	<complexType name="attribute">
		<attribute name="value" type="string"></attribute>
		<attribute name="condition" type="string"/>
	</complexType>

	<complexType name="equipable">
		<sequence>
			<element name="slot" type="Q1:slot" minOccurs="0" maxOccurs="unbounded"></element>
		</sequence>
	</complexType>

	<complexType name="slot">
		<attribute name="name" type="string"></attribute>
	</complexType>

	<complexType name="damage">
		<attribute name="type" type="string" />
	</complexType>

	<complexType name="susceptibility">
		<attribute name="type" type="string" />
		<attribute name="value" type="decimal" />
	</complexType>

	<complexType name="statusresist">
		<attribute name="type" type="string" />
		<attribute name="value" type="decimal" />
		<attribute name="slots" type="string" />
	</complexType>
</schema>
