<?xml version="1.0" encoding="UTF-8" standalone="no"?>
<items xmlns="stendhal" xmlns:xsi="http://www.w3.org/2001/XMLSchema-instance" xsi:schemaLocation="stendhal ../items.xsd ">

	<item name="arandula">
		<type class="herb" subclass="arandula" tileid="-1"/>
		<description>Oto arandula. Zioło to ma właściwości lecznicze, jeśli wiesz jak je użyć.</description>
		<implementation class-name="games.stendhal.server.entity.item.StackableItem"/>
		<attributes>
			<quantity value="1"/>
			<max_quantity value="2147483647"/>
		</attributes>
		<weight value="0.01"/>
		<value value="11"/>
		<equipable>
			<slot name="ground"/>
			<slot name="content"/>
			<slot name="lhand"/>
			<slot name="rhand"/>
			<slot name="bag"/>
			<slot name="trade"/>
		</equipable>
	</item>

	<item name="kokuda">
		<type class="herb" subclass="kokuda" tileid="-1"/>
		<description>Oto kokuda. Zioło to ma właściwości lecznicze, jeśli wiesz jak je użyć.</description>
		<implementation class-name="games.stendhal.server.entity.item.StackableItem"/>
		<attributes>
			<quantity value="1"/>
			<max_quantity value="2147483647"/>
		</attributes>
		<weight value="0.01"/>
		<value value="225"/>
		<equipable>
			<slot name="ground"/>
			<slot name="content"/>
			<slot name="lhand"/>
			<slot name="rhand"/>
			<slot name="bag"/>
			<slot name="trade"/>
		</equipable>
	</item>

	<item name="kekik">
		<type class="herb" subclass="kekik" tileid="-1"/>
		<description>Oto kekik. Ziele to posiada właściwości lecznicze.</description>
		<implementation class-name="games.stendhal.server.entity.item.StackableItem"/>
		<attributes>
			<quantity value="1"/>
			<max_quantity value="2147483647"/>
		</attributes>
		<weight value="0.01"/>
		<value value="27"/>
		<equipable>
			<slot name="ground"/>
			<slot name="content"/>
			<slot name="lhand"/>
			<slot name="rhand"/>
			<slot name="bag"/>
			<slot name="trade"/>
		</equipable>
	</item>

	<item name="mandragora">
		<type class="herb" subclass="mandragora" tileid="-1"/>
		<description>Oto korzeń mandragory. Ma właściwości lecznicze o ile wiesz jak je wydobyć.</description>
		<implementation class-name="games.stendhal.server.entity.item.StackableItem"/>
		<attributes>
			<quantity value="1"/>
			<max_quantity value="2147483647"/>
		</attributes>
		<weight value="0.01"/>
		<value value="300"/>
		<equipable>
			<slot name="ground"/>
			<slot name="content"/>
			<slot name="lhand"/>
			<slot name="rhand"/>
			<slot name="bag"/>
			<slot name="trade"/>
		</equipable>
	</item>

	<item name="sclaria">
		<type class="herb" subclass="sclaria" tileid="-1"/>
		<description>Oto zioło sclaria. Ma łagodny zapach.</description>
		<implementation class-name="games.stendhal.server.entity.item.StackableItem"/>
		<attributes>
			<quantity value="1"/>
			<max_quantity value="2147483647"/>
		</attributes>
		<weight value="0.01"/>
		<value value="27"/>
		<equipable>
			<slot name="ground"/>
			<slot name="content"/>
			<slot name="lhand"/>
			<slot name="rhand"/>
			<slot name="bag"/>
			<slot name="trade"/>
		</equipable>
	</item>

	<item name="pokrzywa">
		<type class="herb" subclass="pokrzywa" tileid="-1"/>
		<description>Oto pokrzywa. Możesz jej używać do robienia wywarów i naparów.</description>
		<implementation class-name="games.stendhal.server.entity.item.StackableItem"/>
		<attributes>
			<quantity value="1"/>
			<max_quantity value="2147483647"/>
		</attributes>
		<weight value="0.01"/>
		<value value="1"/>
		<equipable>
			<slot name="ground"/>
			<slot name="content"/>
			<slot name="lhand"/>
			<slot name="rhand"/>
			<slot name="bag"/>
			<slot name="trade"/>
		</equipable>
	</item>

	<item name="mięta">
		<type class="herb" subclass="mint" tileid="-1"/>
		<description>Oto liście mięty. Możesz ich używać do robienia naparów.</description>
		<implementation class-name="games.stendhal.server.entity.item.StackableItem"/>
		<attributes>
			<quantity value="1"/>
			<max_quantity value="2147483647"/>
		</attributes>
		<weight value="0.01"/>
		<value value="1"/>
		<equipable>
			<slot name="ground"/>
			<slot name="content"/>
			<slot name="lhand"/>
			<slot name="rhand"/>
			<slot name="bag"/>
			<slot name="trade"/>
		</equipable>
	</item>

	<item name="babka lekarska">
		<type class="herb" subclass="babka_lekarska" tileid="-1"/>
		<description>Oto babka lekarska. Jeśli wiesz jak jej użyć możesz uleczyć rany.</description>
		<implementation class-name="games.stendhal.server.entity.item.StackableItem"/>
		<attributes>
			<quantity value="1"/>
			<max_quantity value="2147483647"/>
		</attributes>
		<weight value="0.01"/>
		<value value="1"/>
		<equipable>
			<slot name="ground"/>
			<slot name="content"/>
			<slot name="lhand"/>
			<slot name="rhand"/>
			<slot name="bag"/>
			<slot name="trade"/>
		</equipable>
	</item>
	<item name="mech renifera">
		<type class="herb" subclass="reindeer_moss" tileid="-1"/>
		<description>Oto mech renifera, który rosnie tylko w okolicach Semos. Jest całkiem delikatny dla reniferów, ale strasznie gorzki dla ludzi.</description>
		<implementation class-name="games.stendhal.server.entity.item.Item" />
		<attributes>
			<quantity value="1"/>
			<max_quantity value="2147483647"/>
			<autobind value=""/>
		</attributes>
		<weight value="0.01"/>
		<value value="1"/>
		<equipable>
			<slot name="ground"/>
			<slot name="content"/>
			<slot name="lhand"/>
			<slot name="rhand"/>
			<slot name="bag"/>
		</equipable>
	</item>
</items>
