<?xml version="1.0" encoding="UTF-8" standalone="no"?>
<items xmlns="stendhal" xmlns:xsi="http://www.w3.org/2001/XMLSchema-instance" xsi:schemaLocation="stendhal ../items.xsd ">

	<item name="talizman szczęścia">
		<type class="special" subclass="lucky_charm" tileid="-1"/>
		<description>Oto talizman szczęścia. Niektórzy uważają, że w jakiś sposób to im przynosi szczęście, natomiast inni uważają, że to przesąd.</description>
		<implementation class-name="games.stendhal.server.entity.item.StackableItem"/>
		<attributes>
			<quantity value="1"/>
			<max_quantity value="2147483647"/>
			<autobind value=""/>
		</attributes>
		<weight value="1.0"/>
		<value value="60"/>
		<equipable>
			<slot name="ground"/>
			<slot name="content"/>
			<slot name="lhand"/>
			<slot name="rhand"/>
			<slot name="keyring"/>
			<slot name="bag"/>
			<slot name="trade"/>
		</equipable>
	</item>

	<item name="brosza z mithrilu">
		<type class="special" subclass="mithril_clasp" tileid="-1"/>
		<description>Oto brosza z mithrilu. Może służyć jako zapinka do płaszcza.</description>
		<implementation class-name="games.stendhal.server.entity.item.Item"/>
		<attributes>
		</attributes>
		<weight value="1.0"/>
		<value value="120"/>
		<equipable>
			<slot name="ground"/>
			<slot name="content"/>
			<slot name="bag"/>
			<slot name="trade"/>
			<slot name="lhand"/>
			<slot name="rhand"/>
		</equipable>
	</item>

	<item name="mityczne jajo">
		<type class="special" subclass="mythical_egg" tileid="-1"/>
		<description>Oto mityczne jajo, ale nie wiesz po co jest.</description>
		<implementation class-name="games.stendhal.server.entity.item.StackableItem"/>
		<attributes>
			<quantity value="1"/>
			<max_quantity value="2147483647"/>
		</attributes>
		<weight value="1.0"/>
		<value value="2500"/>
		<equipable>
			<slot name="ground"/>
			<slot name="content"/>
			<slot name="lhand"/>
			<slot name="rhand"/>
			<slot name="bag"/>
			<slot name="trade"/>
		</equipable>
	</item>


	<item name="magiczne skorupki">
		<type class="special" subclass="eggshells" tileid="-1"/>
		<description>Oto magiczne skorupki. Mają magiczne właściwości.</description>
		<implementation class-name="games.stendhal.server.entity.item.StackableItem"/>
		<attributes>
			<quantity value="1"/>
			<max_quantity value="2147483647"/>
		</attributes>
		<weight value="0.01"/>
		<value value="1"/>
		<equipable>
			<slot name="ground"/>
			<slot name="content"/>
			<slot name="bag"/>
			<slot name="trade"/>
			<slot name="lhand"/>
			<slot name="rhand"/>
		</equipable>
	</item>

	<item name="złoty żeton GMa">
		<type class="special" subclass="GM_tokend_gold2" tileid="-1"/>
		<description>Oto złoty żeton GMa. Czy to napawa cię dumą?</description>
		<implementation class-name="games.stendhal.server.entity.item.StackableItem"/>
		<unattainable/>
		<attributes>
			<quantity value="1"/>
			<max_quantity value="2147483647"/>
		</attributes>
		<weight value="0.01"/>
		<value value="1"/>
		<equipable>
			<slot name="ground"/>
			<slot name="content"/>
			<slot name="lhand"/>
			<slot name="rhand"/>
			<slot name="bag"/>
			<slot name="trade"/>
		</equipable>
	</item>

	<item name="srebrny żeton GMa">
		<type class="special" subclass="GM_tokend_silver" tileid="-1"/>
		<description>Oto srebrny żeton GMa. Czy to napawa cię dumą?</description>
		<implementation class-name="games.stendhal.server.entity.item.StackableItem"/>
		<unattainable/>
		<attributes>
			<quantity value="1"/>
			<max_quantity value="2147483647"/>
		</attributes>
		<weight value="0.01"/>
		<value value="1"/>
		<equipable>
			<slot name="ground"/>
			<slot name="content"/>
			<slot name="lhand"/>
			<slot name="rhand"/>
			<slot name="bag"/>
			<slot name="trade"/>
		</equipable>
	</item>

	<item name="brązowy żeton GMa">
		<type class="special" subclass="GM_tokend_bronze" tileid="-1"/>
		<description>Oto brązowy żeton GMa. Czy to napawa cię dumą?</description>
		<implementation class-name="games.stendhal.server.entity.item.StackableItem"/>
		<unattainable/>
		<attributes>
			<quantity value="1"/>
			<max_quantity value="2147483647"/>
		</attributes>
		<weight value="0.01"/>
		<value value="1"/>
		<equipable>
			<slot name="ground"/>
			<slot name="content"/>
			<slot name="lhand"/>
			<slot name="rhand"/>
			<slot name="bag"/>
			<slot name="trade"/>
		</equipable>
	</item>

	<item name="złoty puchar">
		<type class="special" subclass="puchar" tileid="-1"/>
		<description>Oto złoty puchar. Jest on dowodem na to, że zwyciężyłeś na jednym z wielu dużych uroczystości! :) Administracja gry życzy Ci dalszych sukcesów!</description>
		<implementation class-name="games.stendhal.server.entity.item.StackableItem"/>
		<attributes>
			<quantity value="1"/>
			<max_quantity value="2147483647"/>
			<undroppableondeath value="1" />
		</attributes>
		<weight value="0.01"/>
		<value value="1"/>
		<equipable>
			<slot name="ground"/>
			<slot name="content"/>
			<slot name="bag"/>
		</equipable>
	</item>

	<item name="piłka">
		<type class="special" subclass="ball" tileid="-1"/>
		<description>Oto piłka. Znajdź kilku kumpli i zagrajcie sobie mecz.</description>
		<implementation class-name="games.stendhal.server.entity.item.Item"/>
		<attributes>
			<quantity value="1"/>
			<max_quantity value="2147483647"/>
		</attributes>
		<weight value="0.01"/>
		<value value="1"/>
		<equipable>
			<slot name="ground"/>
			<slot name="content"/>
			<slot name="bag"/>
		</equipable>
	</item>

	<item name="płaszcz czerwonego kapturka">
		<type class="cloak" subclass="brightred_cloak" tileid="-1"/>
		<description>Oto płaszcz czerwonego kapturka. Pewna mała dziewczynka o imieniu Balbina o nim marzy.</description>
		<implementation class-name="games.stendhal.server.entity.item.Item"/>
		<attributes/>
		<weight value="1.0"/>
		<value value="1"/>
		<equipable>
			<slot name="ground"/>
			<slot name="content"/>
			<slot name="cloak"/>
			<slot name="bag"/>
		</equipable>
	</item>

	<item name="czterolistna koniczyna">
		<type class="special" subclass="clover" tileid="-1"/>
		<description>Oto szczęśliwa czterolistna koniczyna. Jakie są szanse na znalezienie takiej!?</description>
		<implementation class-name="games.stendhal.server.entity.item.StackableItem"/>
		<attributes>
			<quantity value="1"/>
			<max_quantity value="2147483647"/>
		</attributes>
		<weight value="0.01"/>
		<value value="150"/>
		<equipable>
			<slot name="ground"/>
			<slot name="content"/>
			<slot name="lhand"/>
			<slot name="rhand"/>
			<slot name="keyring"/>
			<slot name="bag"/>
			<slot name="trade"/>
		</equipable>
	</item>
</items>
