<?xml version="1.0" encoding="UTF-8" standalone="no"?>
<items xmlns="stendhal" xmlns:xsi="http://www.w3.org/2001/XMLSchema-instance" xsi:schemaLocation="stendhal ../items.xsd ">

	<item name="ametyst">
		<type class="jewellery" subclass="amethyst" tileid="-1"/>
		<description>Oto ametyst, cenny klejnot.</description>
		<implementation class-name="games.stendhal.server.entity.item.StackableItem"/>
		<attributes>
			<quantity value="1"/>
			<max_quantity value="2147483647"/>
		</attributes>
		<weight value="1.0"/>
		<value value="500"/>
		<equipable>
			<slot name="ground"/>
			<slot name="content"/>
			<slot name="bag"/>
			<slot name="trade"/>
			<slot name="lhand"/>
			<slot name="rhand"/>
		</equipable>
	</item>
	
	<item name="szmaragd">
		<type class="jewellery" subclass="emerald" tileid="-1"/>
		<description>Oto szmaragd, cenny klejnot.</description>
		<implementation class-name="games.stendhal.server.entity.item.StackableItem"/>
		<attributes>
			<quantity value="1"/>
			<max_quantity value="2147483647"/>
		</attributes>
		<weight value="1.0"/>
		<value value="200"/>
		<equipable>
			<slot name="ground"/>
			<slot name="content"/>
			<slot name="bag"/>
			<slot name="trade"/>
			<slot name="lhand"/>
			<slot name="rhand"/>
		</equipable>
	</item>

	<item name="szafir">
		<type class="jewellery" subclass="sapphire" tileid="-1"/>
		<description>Oto szafir, cenny klejnot.</description>
		<implementation class-name="games.stendhal.server.entity.item.StackableItem"/>
		<attributes>
			<quantity value="1"/>
			<max_quantity value="2147483647"/>
		</attributes>
		<weight value="1.0"/>
		<value value="400"/>
		<equipable>
			<slot name="ground"/>
			<slot name="content"/>
			<slot name="bag"/>
			<slot name="trade"/>
			<slot name="lhand"/>
			<slot name="rhand"/>
		</equipable>
	</item>

	<item name="rubin">
		<type class="jewellery" subclass="carbuncle" tileid="-1"/>
		<description>Oto rubin, cenny klejnot.</description>
		<implementation class-name="games.stendhal.server.entity.item.StackableItem"/>
		<attributes>
			<quantity value="1"/>
			<max_quantity value="2147483647"/>
		</attributes>
		<weight value="1.0"/>
		<value value="600"/>
		<equipable>
			<slot name="ground"/>
			<slot name="content"/>
			<slot name="bag"/>
			<slot name="trade"/>
			<slot name="lhand"/>
			<slot name="rhand"/>
		</equipable>
	</item>

	<item name="obsydian">
		<type class="jewellery" subclass="obsidian" tileid="-1"/>
		<description>Oto obsydian, znany jako szkło magmowe, ponieważ lawa gdy zastyga przyjmuje taki wygląd.</description>
		<implementation class-name="games.stendhal.server.entity.item.StackableItem"/>
		<attributes>
			<quantity value="1"/>
			<max_quantity value="2147483647"/>
		</attributes>
		<weight value="1.0"/>
		<value value="1000"/>
		<equipable>
			<slot name="ground"/>
			<slot name="content"/>
			<slot name="bag"/>
			<slot name="trade"/>
			<slot name="lhand"/>
			<slot name="rhand"/>
		</equipable>
	</item>

	<item name="diament">
		<type class="jewellery" subclass="diamond" tileid="-1"/>
		<description>Oto diament. To nie tylko piękny klejnot ale i najtwardszy materiał.</description>
		<implementation class-name="games.stendhal.server.entity.item.StackableItem"/>
		<attributes>
			<quantity value="1"/>
			<max_quantity value="2147483647"/>
		</attributes>
		<weight value="1.0"/>
		<value value="800"/>
		<equipable>
			<slot name="ground"/>
			<slot name="content"/>
			<slot name="bag"/>
			<slot name="trade"/>
			<slot name="lhand"/>
			<slot name="rhand"/>
		</equipable>
	</item>

	<item name="czarna perła">
		<type class="jewellery" subclass="blackpearl" tileid="-1"/>
		<description>Oto czarna perła, mimo iż jest czarna, cała lśni.</description>
		<implementation class-name="games.stendhal.server.entity.item.StackableItem"/>
		<attributes>
			<quantity value="1"/>
			<max_quantity value="2147483647"/>
		</attributes>
		<weight value="1.0"/>
		<value value="100"/>
		<equipable>
			<slot name="ground"/>
			<slot name="content"/>
			<slot name="bag"/>
			<slot name="trade"/>
			<slot name="lhand"/>
			<slot name="rhand"/>
		</equipable>
	</item>

	<item name="kryształ diamentu">
		<type class="jewellery" subclass="diamond_crystal" tileid="-1"/>
		<description>Oto kryształ diamentu, cenny nieoszlifowany klejnot.</description>
		<implementation class-name="games.stendhal.server.entity.item.StackableItem"/>
		<attributes>
			<quantity value="1"/>
			<max_quantity value="2147483647"/>
		</attributes>
		<weight value="1.0"/>
		<value value="267"/>
		<equipable>
			<slot name="ground"/>
			<slot name="content"/>
			<slot name="bag"/>
			<slot name="trade"/>
			<slot name="lhand"/>
			<slot name="rhand"/>
		</equipable>
	</item>

	<item name="kryształ ametystu">
		<type class="jewellery" subclass="amethyst_crystal" tileid="-1"/>
		<description>Oto kryształ ametystu, cenny nieoszlifowany klejnot.</description>
		<implementation class-name="games.stendhal.server.entity.item.StackableItem"/>
		<attributes>
			<quantity value="1"/>
			<max_quantity value="2147483647"/>
		</attributes>
		<weight value="1.0"/>
		<value value="267"/>
		<equipable>
			<slot name="ground"/>
			<slot name="content"/>
			<slot name="bag"/>
			<slot name="trade"/>
			<slot name="lhand"/>
			<slot name="rhand"/>
		</equipable>
	</item>

	<item name="kryształ szmaragdu">
		<type class="jewellery" subclass="emerald_crystal" tileid="-1"/>
		<description>Oto kryształ szmaragdu, cenny nieoszlifowany klejnot.</description>
		<implementation class-name="games.stendhal.server.entity.item.StackableItem"/>
		<attributes>
			<quantity value="1"/>
			<max_quantity value="2147483647"/>
		</attributes>
		<weight value="1.0"/>
		<value value="267"/>
		<equipable>
			<slot name="ground"/>
			<slot name="content"/>
			<slot name="bag"/>
			<slot name="trade"/>
			<slot name="lhand"/>
			<slot name="rhand"/>
		</equipable>
	</item>

	<item name="kryształ szafiru">
		<type class="jewellery" subclass="sapphire_crystal" tileid="-1"/>
		<description>Oto kryształ szafiru, cenny nieoszlifowany klejnot.</description>
		<implementation class-name="games.stendhal.server.entity.item.StackableItem"/>
		<attributes>
			<quantity value="1"/>
			<max_quantity value="2147483647"/>
		</attributes>
		<weight value="1.0"/>
		<value value="267"/>
		<equipable>
			<slot name="ground"/>
			<slot name="content"/>
			<slot name="bag"/>
			<slot name="trade"/>
			<slot name="lhand"/>
			<slot name="rhand"/>
		</equipable>
	</item>

	<item name="kryształ rubinu">
		<type class="jewellery" subclass="carbuncle_crystal" tileid="-1"/>
		<description>Oto kryształ rubinu, cenny nieoszlifowany klejnot.</description>
		<implementation class-name="games.stendhal.server.entity.item.StackableItem"/>
		<attributes>
			<quantity value="1"/>
			<max_quantity value="2147483647"/>
		</attributes>
		<weight value="1.0"/>
		<value value="267"/>
		<equipable>
			<slot name="ground"/>
			<slot name="content"/>
			<slot name="bag"/>
			<slot name="trade"/>
			<slot name="lhand"/>
			<slot name="rhand"/>
		</equipable>
	</item>

	<item name="kryształ obsydianu">
		<type class="jewellery" subclass="obsidian_crystal" tileid="-1"/>
		<description>Oto kryształ obsydianu, cenny nieoszlifowany klejnot.</description>
		<implementation class-name="games.stendhal.server.entity.item.StackableItem"/>
		<attributes>
			<quantity value="1"/>
			<max_quantity value="2147483647"/>
		</attributes>
		<weight value="1.0"/>
		<value value="267"/>
		<equipable>
			<slot name="ground"/>
			<slot name="content"/>
			<slot name="bag"/>
			<slot name="trade"/>
			<slot name="lhand"/>
			<slot name="rhand"/>
		</equipable>
	</item>

	<item name="kryształ ciemnolitu">
		<type class="jewellery" subclass="nocturium_crystal" tileid="-1"/>
		<description>Oto kryształ ciemnolitu, łączący kamień światłości z mrokiem. Druga strona wręcz hipnotyzuje.</description>
		<implementation class-name="games.stendhal.server.entity.item.StackableItem"/>
		<attributes>
			<quantity value="1"/>
			<max_quantity value="2147483647"/>
		</attributes>
		<weight value="1.0"/>
		<value value="1"/>
		<equipable>
			<slot name="ground"/>
			<slot name="content"/>
			<slot name="lhand"/>
			<slot name="rhand"/>
			<slot name="bag"/>
			<slot name="trade"/>
		</equipable>
	</item>

	<item name="klejnot ciemnolitu">
		<type class="jewellery" subclass="nocturium_gem" tileid="-1"/>
		<description>Oto klejnot ciemnolitu. Gdy się przypatrzysz to wewnątrz klejnotu jakby padał deszcz.</description>
		<implementation class-name="games.stendhal.server.entity.item.StackableItem"/>
		<attributes>
			<quantity value="1"/>
			<max_quantity value="2147483647"/>
		</attributes>
		<weight value="1.0"/>
		<value value="1"/>
		<equipable>
			<slot name="ground"/>
			<slot name="content"/>
			<slot name="lhand"/>
			<slot name="rhand"/>
			<slot name="bag"/>
			<slot name="trade"/>
		</equipable>
	</item>
</items>
