<?xml version="1.0" encoding="UTF-8"?>
<items xmlns="stendhal" xmlns:xsi="http://www.w3.org/2001/XMLSchema-instance"
	xsi:schemaLocation="stendhal ../items.xsd ">

	<item name="srebrny pierścień">
    <type class="animation_ring" subclass="silver_ring" tileid="-1"/>
    <description>Oto srebrny pierścień.</description>
    <implementation class-name="games.stendhal.server.entity.item.Item"/>
    <attributes>
      <atk value="2"/>
      <def value="2"/>
    </attributes>
    <weight value="0.1"/>
    <value value="323032"/>
    <susceptibility type="dark" value="0.83"/>
    <susceptibility type="light" value="1.11"/>
    <equipable>
      <slot name="ground"/>
      <slot name="content"/>
      <slot name="bag"/>
      <slot name="trade"/>
      <slot name="finger"/>
      <slot name="fingerb"/>
      <slot name="keyring"/>
    </equipable>
  </item>

	<item name="złoty pierścień">
    <type class="animation_ring" subclass="golden_ring" tileid="-1"/>
    <description>Oto złoty pierścień.</description>
    <implementation class-name="games.stendhal.server.entity.item.Item"/>
    <attributes>
      <atk value="3"/>
      <def value="3"/>
    </attributes>
    <weight value="0.1"/>
    <value value="323032"/>
    <susceptibility type="dark" value="1.11"/>
    <susceptibility type="light" value="0.83"/>
    <equipable>
      <slot name="ground"/>
      <slot name="content"/>
      <slot name="bag"/>
      <slot name="trade"/>
      <slot name="finger"/>
      <slot name="fingerb"/>
      <slot name="keyring"/>
    </equipable>
  </item>

  <item name="pierścień z mithrilu">
    <type class="animation_ring" subclass="mithril_ring" tileid="-1"/>
    <description>Oto pierścień z mithrilu. Został wykonany z bardzo wysoko-jakościowego materiału.</description>
    <implementation class-name="games.stendhal.server.entity.item.Item"/>
    <attributes>
      <atk value="4"/>
      <def value="5"/>
    </attributes>
    <weight value="0.1"/>
    <value value="323032"/>
    <susceptibility type="dark" value="1.11"/>
    <susceptibility type="light" value="0.83"/>
    <equipable>
      <slot name="ground"/>
      <slot name="content"/>
      <slot name="bag"/>
      <slot name="trade"/>
      <slot name="finger"/>
      <slot name="fingerb"/>
      <slot name="keyring"/>
    </equipable>
  </item>

  <item name="czarny pierścień">
    <type class="ring" subclass="black_ring" tileid="-1"/>
    <description>Oto czarny pierścień. Czujesz wielką siłę kiedy go nosisz.</description>
    <implementation class-name="games.stendhal.server.entity.item.Item"/>
    <attributes>
      <atk value="5"/>
      <def value="4"/>
    </attributes>
    <weight value="0.1"/>
    <value value="123032"/>
    <susceptibility type="dark" value="0.83"/>
    <susceptibility type="light" value="1.11"/>
    <equipable>
      <slot name="ground"/>
      <slot name="content"/>
      <slot name="bag"/>
      <slot name="trade"/>
      <slot name="finger"/>
      <slot name="fingerb"/>
      <slot name="keyring"/>
    </equipable>
  </item>
</items>
